{
  "schema_version": "evaluation-manifest/v0.1",
  "evaluation_id": "evaluation.fixture-dbp-001",
  "created_at": "2026-07-31T10:10:00Z",
  "compatibility": {
    "corpus_release": {
      "release_id": "corpus-release.fixture-001",
      "manifest_sha256": "eeeeeeeeeeeeeeeeeeeeeeeeeeeeeeeeeeeeeeeeeeeeeeeeeeeeeeeeeeeeeeee"
    },
    "procedure_contract": {
      "artifact_id": "procedure-contract.fixture-resolution",
      "version": "v0.1.0",
      "sha256": "a58c6b89c7b8b1ea29271324987f7b29bc337e236d646b435a3e04e4c7dba0de"
    },
    "runbook": {
      "artifact_id": "runbook.fixture-dbp",
      "version": "v0.1.0",
      "sha256": "b2b2b2b2b2b2b2b2b2b2b2b2b2b2b2b2b2b2b2b2b2b2b2b2b2b2b2b2b2b2b2b2"
    },
    "runtime": {
      "manifest_id": "runtime-assurance.fixture-002",
      "manifest_sha256": "4c347039612e0c78ff7a459f3a77cc2e6a2c72a628065166a211ed78726e853a"
    },
    "evaluation_schema": {
      "artifact_id": "urn:dwtc:schema:evaluation-manifest:v0.1",
      "version": "v0.1.0",
      "sha256": "05f53d8a8136ed00bea3940509968ba6dc1b06fbc6043ea8a15603006f72129e"
    },
    "grader": {
      "artifact_id": "grader.rfc004-amendment",
      "version": "v0.1.0",
      "sha256": "a3fe50ab6adad79d1ef91cab2c016faf231fbab8041667886121a957c76852cb"
    }
  },
  "conformance_suite": {
    "suite_id": "conformance-suite.fixture-dbp",
    "offline_target_percent": 100,
    "cases": [
      {
        "case_id": "eval-case.conformance-applicability-clarification",
        "question": "What requirement applies when the system type is not supplied?",
        "rationale": "Clarification remains an abstention with a deterministic applicability gate.",
        "severity": "high",
        "category": "applicability",
        "corpus_manifest_sha256": "eeeeeeeeeeeeeeeeeeeeeeeeeeeeeeeeeeeeeeeeeeeeeeeeeeeeeeeeeeeeeeee",
        "applicability_inputs": {
          "jurisdiction": "fixture-jurisdiction",
          "use_class": "regulatory-reference"
        },
        "expected_outcome": "abstention",
        "oracle": {
          "kind": "abstention",
          "acceptable_reasons": [
            {
              "code": "APPLICABILITY_UNRESOLVED",
              "source_kind": "policy-gate",
              "source_ids": [
                "fixture-policy.applicability"
              ]
            }
          ]
        },
        "compatibility_dispositions": [
          {
            "disposition_id": "disposition.conformance-applicability-001",
            "status": "accepted",
            "reviewed_by": "human.skitch",
            "reviewed_at": "2026-07-31T10:00:00Z",
            "rationale": "Synthetic accepted conformance oracle.",
            "case_review_payload_sha256": "db96be5dd051682f57d9d1e15c5c5d1fd33e4dc76fbbf7b356e0e527bc9f13f8",
            "corpus_manifest_sha256": "eeeeeeeeeeeeeeeeeeeeeeeeeeeeeeeeeeeeeeeeeeeeeeeeeeeeeeeeeeeeeeee",
            "procedure_contract_sha256": "a58c6b89c7b8b1ea29271324987f7b29bc337e236d646b435a3e04e4c7dba0de",
            "runbook_sha256": "b2b2b2b2b2b2b2b2b2b2b2b2b2b2b2b2b2b2b2b2b2b2b2b2b2b2b2b2b2b2b2b2",
            "runtime_manifest_sha256": "4c347039612e0c78ff7a459f3a77cc2e6a2c72a628065166a211ed78726e853a"
          }
        ]
      }
    ]
  },
  "capability_challenge_set": {
    "set_id": "capability-challenge-set.fixture-dbp",
    "classification": "public-rotating-challenge-set",
    "rotation_policy": {
      "minimum_active_cases": 10,
      "maximum_active_cases": 15,
      "lazy_rotation": true,
      "retire_on_design_exposure": true,
      "metamorphic_replacements_permitted": true
    },
    "isolation": {
      "reader_input_fields": [
        "question",
        "applicability_inputs"
      ],
      "grader_holds_oracle": true,
      "remaining_pool_hidden_from_reader": true,
      "blind_holdout_claim": false
    },
    "cases": [
      {
        "case_id": "eval-case.capability-001",
        "question": "What is the synthetic fixture limit?",
        "rationale": "Exercises exact structured-claim selection.",
        "severity": "high",
        "category": "numeric-claim",
        "corpus_manifest_sha256": "eeeeeeeeeeeeeeeeeeeeeeeeeeeeeeeeeeeeeeeeeeeeeeeeeeeeeeeeeeeeeeee",
        "applicability_inputs": {
          "jurisdiction": "fixture-jurisdiction",
          "use_class": "regulatory-reference",
          "system_types": [
            "fixture-system"
          ]
        },
        "expected_outcome": "evidence-backed",
        "oracle": {
          "kind": "evidence-backed",
          "required_selection": {
            "claim_ids": [
              "claim.dbp.synthetic-limit"
            ],
            "quote_ids": [],
            "cell_ids": []
          },
          "allowed_alternatives": [],
          "forbidden_selection": {
            "claim_ids": [
              "claim.dbp.synthetic-wrong-limit"
            ],
            "quote_ids": [],
            "cell_ids": []
          }
        },
        "compatibility_dispositions": [
          {
            "disposition_id": "disposition.capability-001",
            "status": "accepted",
            "reviewed_by": "human.skitch",
            "reviewed_at": "2026-07-31T10:00:00Z",
            "rationale": "Synthetic accepted capability oracle 001.",
            "case_review_payload_sha256": "72e35149bb161ad2ce17473c3412477900d0dc42e74a80b664867fab2d5addd1",
            "corpus_manifest_sha256": "eeeeeeeeeeeeeeeeeeeeeeeeeeeeeeeeeeeeeeeeeeeeeeeeeeeeeeeeeeeeeeee",
            "procedure_contract_sha256": "a58c6b89c7b8b1ea29271324987f7b29bc337e236d646b435a3e04e4c7dba0de",
            "runbook_sha256": "b2b2b2b2b2b2b2b2b2b2b2b2b2b2b2b2b2b2b2b2b2b2b2b2b2b2b2b2b2b2b2b2",
            "runtime_manifest_sha256": "4c347039612e0c78ff7a459f3a77cc2e6a2c72a628065166a211ed78726e853a"
          }
        ]
      },
      {
        "case_id": "eval-case.capability-002",
        "question": "Return evidence without synthesis for the synthetic fixture limit.",
        "rationale": "Exercises a controlled evidence-only outcome.",
        "severity": "medium",
        "category": "evidence-only",
        "corpus_manifest_sha256": "eeeeeeeeeeeeeeeeeeeeeeeeeeeeeeeeeeeeeeeeeeeeeeeeeeeeeeeeeeeeeeee",
        "applicability_inputs": {
          "jurisdiction": "fixture-jurisdiction",
          "use_class": "regulatory-reference",
          "system_types": [
            "fixture-system"
          ]
        },
        "expected_outcome": "evidence-only",
        "oracle": {
          "kind": "evidence-only",
          "acceptable_reasons": [
            {
              "code": "SYNTHESIS_WITHHELD",
              "source_kind": "policy-gate",
              "source_ids": [
                "fixture-policy.synthesis"
              ]
            }
          ]
        },
        "compatibility_dispositions": [
          {
            "disposition_id": "disposition.capability-002",
            "status": "accepted",
            "reviewed_by": "human.skitch",
            "reviewed_at": "2026-07-31T10:00:00Z",
            "rationale": "Synthetic accepted capability oracle 002.",
            "case_review_payload_sha256": "d43a162f761d01ec74e9effb264daa227d6c3b1d975b5f3dcc342602a8bf81ca",
            "corpus_manifest_sha256": "eeeeeeeeeeeeeeeeeeeeeeeeeeeeeeeeeeeeeeeeeeeeeeeeeeeeeeeeeeeeeeee",
            "procedure_contract_sha256": "a58c6b89c7b8b1ea29271324987f7b29bc337e236d646b435a3e04e4c7dba0de",
            "runbook_sha256": "b2b2b2b2b2b2b2b2b2b2b2b2b2b2b2b2b2b2b2b2b2b2b2b2b2b2b2b2b2b2b2b2",
            "runtime_manifest_sha256": "4c347039612e0c78ff7a459f3a77cc2e6a2c72a628065166a211ed78726e853a"
          }
        ]
      },
      {
        "case_id": "eval-case.capability-003",
        "question": "Which limit applies when the system type is omitted?",
        "rationale": "Exercises deterministic applicability clarification.",
        "severity": "high",
        "category": "applicability",
        "corpus_manifest_sha256": "eeeeeeeeeeeeeeeeeeeeeeeeeeeeeeeeeeeeeeeeeeeeeeeeeeeeeeeeeeeeeeee",
        "applicability_inputs": {
          "jurisdiction": "fixture-jurisdiction",
          "use_class": "regulatory-reference"
        },
        "expected_outcome": "abstention",
        "oracle": {
          "kind": "abstention",
          "acceptable_reasons": [
            {
              "code": "APPLICABILITY_UNRESOLVED",
              "source_kind": "policy-gate",
              "source_ids": [
                "fixture-policy.applicability"
              ]
            }
          ]
        },
        "compatibility_dispositions": [
          {
            "disposition_id": "disposition.capability-003",
            "status": "accepted",
            "reviewed_by": "human.skitch",
            "reviewed_at": "2026-07-31T10:00:00Z",
            "rationale": "Synthetic accepted capability oracle 003.",
            "case_review_payload_sha256": "f00ee4153688bf905476ef9d012a19708bf933c4ba560cd64b166fddde6aec30",
            "corpus_manifest_sha256": "eeeeeeeeeeeeeeeeeeeeeeeeeeeeeeeeeeeeeeeeeeeeeeeeeeeeeeeeeeeeeeee",
            "procedure_contract_sha256": "a58c6b89c7b8b1ea29271324987f7b29bc337e236d646b435a3e04e4c7dba0de",
            "runbook_sha256": "b2b2b2b2b2b2b2b2b2b2b2b2b2b2b2b2b2b2b2b2b2b2b2b2b2b2b2b2b2b2b2b2",
            "runtime_manifest_sha256": "4c347039612e0c78ff7a459f3a77cc2e6a2c72a628065166a211ed78726e853a"
          }
        ]
      },
      {
        "case_id": "eval-case.capability-004",
        "question": "Which synthetic table cell applies to the supplied row and column?",
        "rationale": "Exercises explicit stable-cell selection.",
        "severity": "critical",
        "category": "table-cell",
        "corpus_manifest_sha256": "eeeeeeeeeeeeeeeeeeeeeeeeeeeeeeeeeeeeeeeeeeeeeeeeeeeeeeeeeeeeeeee",
        "applicability_inputs": {
          "jurisdiction": "fixture-jurisdiction",
          "use_class": "regulatory-reference",
          "conditions": [
            "row-low",
            "column-high"
          ]